{
  "schema_version": 2,
  "id": "fivefold-repetition",
  "canonical_name": "Fivefold repetition",
  "alternate_names": [],
  "historical_names": [],
  "category": "official-rules",
  "subcategory": "basic rules of play",
  "tags": [],
  "knowledge_type": "official-rule",
  "knowledge_type_note": "Official rule; the automatic counterpart to the claimable Art. 9.2.",
  "name_status": "established-name",
  "difficulty": "intermediate",
  "definition_short": "If the same position appears five times, the game is drawn automatically — no claim needed.",
  "definition_long": "FIDE Art. 9.6.1: the game is drawn if 'the same position has appeared, as in 9.2.2 at least five times.' Unlike threefold repetition this needs no claim and no agreement; it happens by force of the Laws. Introduced so that a game cannot continue indefinitely when neither player claims.",
  "history": {
    "attributions": [],
    "first_documented_source": "fide-laws-2023",
    "year": null,
    "confidence": "unknown",
    "notes": "",
    "competing_claims": [],
    "development": []
  },
  "engine_era_status": "not-applicable",
  "engine_era_note": "",
  "sources": [
    "fide-laws-2023",
    "fide-laws-2023-pdf"
  ],
  "source_confidence": "high",
  "recognition": {
    "preconditions": [
      "The same position, by the Art. 9.2.3 test, has occurred five times"
    ],
    "indicators_for": [],
    "indicators_against": [],
    "prerequisites": [],
    "detector": "posKey",
    "detectability": "mechanical",
    "typical_confidence": "high",
    "false_positive_traps": []
  },
  "application": {
    "typical_plans": [],
    "typical_moves": [],
    "typical_pawn_structures": [],
    "typical_piece_arrangements": [],
    "tactical_consequences": [],
    "strategic_consequences": []
  },
  "exceptions": [],
  "limitations": [
    "TYPICAL_CONFIDENCE RAISED medium -> high, 2026-09-02, and the reason is the schema's own definition of the field: 'how confidently this concept can normally be asserted ONCE ITS PRECONDITIONS HOLD'. This concept's recognition is MECHANICAL and its knowledge type already carries a high ceiling, so once the preconditions hold there is nothing left to be uncertain about - a stalemate is a stalemate, and a fork this base reports is one findMotifs() found, which ARCHITECTURE.md makes the authority and forbids second-guessing. 'Medium' was the default across 32 rule and motif records regardless of detectability, and it was found by measuring what the API reports against what each record permits: twelve concepts were reporting ABOVE their own record. The fix was to make each record its own ceiling in cap(), which then required the records that were wrong to be corrected rather than silently overruled."
  ],
  "misconceptions": [],
  "relationships": {
    "broader": [],
    "narrower": [],
    "related": [
      "threefold-repetition"
    ],
    "contrasting": [],
    "co_occurring": [],
    "conflicts": []
  },
  "examples": [],
  "counterexamples": [],
  "ambiguous_examples": [],
  "explanations": {
    "by_level": {
      "beginner": "The same position has appeared five times, so the game is automatically a draw.",
      "intermediate": "Fivefold repetition ends the game at once, with no claim required.",
      "advanced": "Art. 9.6.1."
    },
    "by_depth": {},
    "hedge": "",
    "lesson": ""
  },
  "terminology": {
    "beginner_words": [
      "automatic draw"
    ],
    "advanced_words": [
      "fivefold repetition"
    ],
    "avoid": []
  },
  "status": {
    "stage": "researched",
    "last_updated": "2026-08-31",
    "open_questions": [],
    "audit_notes": [
      "2026-09-01 audit: flagged as short relative to the median record. REVIEWED AND ACCEPTED — this is a simple, fully specified rule quoted from the FIDE Laws. There is no further research to do, and padding it to match the median would add words without adding knowledge. Short is the correct length here."
    ]
  }
}